{
  "$schema": "https://fluidsbench.org/schemas/methodology-contract-v1.schema.json",
  "format": "fluidsbench-methodology-contract-v1",
  "dataset_id": "drivaernetplusplus",
  "allow_additional_predicted_fields": true,
  "required_predicted_fields": [
    {
      "field_id": "surface-pressure-native.p",
      "domain": "surface",
      "component_count": 1,
      "description": "Dataset-native kinematic pressure on every official DrivAerNet++ surface point."
    }
  ]
}
